{
  "slug": "ussearch",
  "jurisdiction": { "country": "us" },
  "name": "US Search",
  "category": "people-search",
  "exposesDeadnameRisk": "high",
  "searchUrl": "https://www.ussearch.com/",
  "optOut": {
    "methods": ["web-form"],
    "webFormUrl": "https://www.ussearch.com/opt-out/",
    "email": null,
    "mailingAddress": null,
    "requiresId": false,
    "optOutExposesLinkage": false,
    "steps": [
      "Open the PeopleConnect Suppression Center (this brand's opt-out page redirects there).",
      "Enter your email address, agree to the terms, and submit.",
      "Open the verification email and click the link to proceed.",
      "Search for your listing, select it, and confirm the suppression."
    ],
    "templateKey": "optout-deletion-generic"
  },
  "notes": "US Search is a PeopleConnect brand: one suppression at suppression.peopleconnect.us covers all PeopleConnect people-search sites (Intelius, TruthFinder, Instant Checkmate, US Search, ZabaSearch, Addresses.com). Email-only entry, so the opt-out itself doesn't disclose your name history. Re-check periodically.",
  "attribution": "Derived from Big-Ass Data Broker Opt-Out List (CC BY-NC-SA); flow verified against the live PeopleConnect Suppression Center.",
  "sourceUrl": "https://github.com/yaelwrites/Big-Ass-Data-Broker-Opt-Out-List",
  "lastVerified": "2026-06-30"
}
