{
  "baseLocale": "es",
  "slug": "datacredito",
  "jurisdiction": {
    "country": "co"
  },
  "name": "DataCrédito (Experian Colombia)",
  "category": "credit-bureau",
  "exposesDeadnameRisk": "medium",
  "searchUrl": "https://www.midatacredito.com/",
  "optOut": {
    "methods": [
      "web-form",
      "email",
      "mail"
    ],
    "webFormUrl": "https://www.datacredito.com.co/habeas-data",
    "email": "serviciociudadano@experian.com",
    "mailingAddress": "Carrera 7 No. 76-35, piso 10, Bogotá",
    "requiresId": true,
    "optOutExposesLinkage": false,
    "steps": [
      "Esto es una RECTIFICACIÓN, no un borrado: tu historia de crédito no se elimina por cambiar de nombre, pero tienes derecho a que figure con tu nombre legal actual (Ley 1266 de 2008 y Ley 1581 de 2012).",
      "Primero actualiza tu cédula en la Registraduría — la central verifica contra el documento.",
      "Entra a datacredito.com.co → «Habeas Data» → «Módulo de Reclamos» (gratuito) y radica un reclamo de actualización/rectificación del nombre, adjuntando tu cédula vigente.",
      "También puedes radicarlo por escrito (firma autenticada ante notario + copia de la cédula) a la dirección de Bogotá, o al correo de servicio al ciudadano.",
      "Deben responder en máximo 15 días hábiles; mientras se tramita, el reclamo aparece marcado en tu historia.",
      "Si no responden o la respuesta no corrige el nombre, presenta una queja ante la SIC (sic.gov.co) — solo procede tras agotar el reclamo directo."
    ],
    "templateKey": "reclamo-rectificacion-co"
  },
  "notes": "La central identifica los registros por número de documento, así que el vínculo entre tus nombres ya existe en su base — rectificar no revela nada nuevo. Al enviar, incluye tu número de cédula tú misma/o: Errata no lo pide ni lo guarda.",
  "lastVerified": "2026-07-04",
  "attribution": "Independently authored from the service's own removal/claims flow (not BADBOL-derived)."
}
