{
  "slug": "ownerly",
  "jurisdiction": { "country": "us" },
  "name": "Ownerly",
  "category": "other",
  "exposesDeadnameRisk": "medium",
  "searchUrl": "https://www.ownerly.com/",
  "optOut": {
    "methods": ["web-form"],
    "webFormUrl": "https://www.ownerly.com/svc/optout/search/optouts",
    "email": null,
    "mailingAddress": null,
    "requiresId": false,
    "optOutExposesLinkage": false,
    "steps": [
      "Open the opt-out search page (link below) and search your name.",
      "Select your record from the results.",
      "Enter your email to receive a verification link.",
      "Click the link in the verification email to confirm the removal.",
      "The online form removes one record at a time; to remove more than one, email privacy@ownerly.com."
    ],
    "templateKey": "optout-deletion-generic"
  },
  "notes": "BeenVerified-family; primarily property/home-value, but its people-search listing can surface your name. Separate property-search opt-out exists. Covered persons (Daniel's Law) can email privacy@ownerly.com. Re-check periodically.",
  "attribution": "Derived from Big-Ass Data Broker Opt-Out List (CC BY-NC-SA); flow verified against the live opt-out page.",
  "sourceUrl": "https://github.com/yaelwrites/Big-Ass-Data-Broker-Opt-Out-List",
  "lastVerified": "2026-06-30"
}
